,Username,Link,Text,Human,Chat GPT,Date
,erlindacornelia,https://www.tiktok.com/@erlindacornelia,paket aku belum dikirim dari sabtu,Negatif,Negatif,25/04/2023
,zahhrann200,https://www.tiktok.com/@zahhrann200,"mau dibatalin karena lama sampai nya, tapi percuma nunggu lama-lama",Negatif,Negatif,25/04/2023
,nuuu.360,https://www.tiktok.com/@nuuu.360,buat pengiriman lokasi Jawa Timur kok gak ada pilihan ya bang?,Netral,Netral,25/04/2023
,zeny_9,https://www.tiktok.com/@zeny_9,aku saranin jagan beli nih parfum wangi nya ga enak banget bikin pusing,Negatif,Negatif,25/04/2023
,sevagaming420seba,https://www.tiktok.com/@sevagaming420seba,gak ada voucher gratis ongkos kirim kah ini? mahal banget,Negatif,Negatif,25/04/2023
,delis4615,https://www.tiktok.com/@delis4615,"buat aku yang anak sekolahan, masih masuk di kantong sih harga nya,wangi nya juga cocok buat anak sekolah",Positif,Positif,25/04/2023
,mamahekowbc,https://www.tiktok.com/@mamahekowbc,dari dulu emang selalu pakai Morris ga pernah kecewa sama parfum satu ini,Positif,Positif,25/04/2023
,delarmi72,https://www.tiktok.com/@delarmi72,kurang full ya isian nya,Negatif,Negatif,25/04/2023
,daiici_record,https://www.tiktok.com/@daiici_record,tolong lah itu host nya di ganti cuek banget yang sekarang,Negatif,Negatif,25/04/2023
,azhamaharani,https://www.tiktok.com/@azhamaharani,bohong aku udah nyobain 3 jenis wangi nya ga tahan lama,Negatif,Negatif,25/04/2023
,aihsari,https://www.tiktok.com/@aihsari,pengiriman ke bandung 2 minggu lama banget asli ,Negatif,Negatif,25/04/2023
,fitrabudury182,https://www.tiktok.com/@fitrabudury182,"udah hampir seminggu masih di pengemasan, belum dikirim-kirim",Negatif,Negatif,24/04/2023
,holani_natalia7,https://www.tiktok.com/@holani_natalia7,punya aku kok sampai sekarang belum sampai ya kak,Negatif,Negatif,24/04/2023
,scriptscript63,https://www.tiktok.com/@scriptscript63,aku beli langsung jadi idola wanita,Positif,Positif,24/04/2023
,badrurizqi,https://www.tiktok.com/@badrurizqi,wangi gak ya yang glory? Soal nya udah beli,Netral,Netral,24/04/2023
,bangjait219,https://www.tiktok.com/@bangjait219,"wangi nya manis, segar gitu, enak deh",Positif,Positif,24/04/2023
,riko00733,https://www.tiktok.com/@riko00733,harga berapa? ,Netral,Netral,24/04/2023
,pujinita,https://www.tiktok.com/@pujinita,mahal banget deh ongkos kirim nya,Negatif,Negatif,24/04/2023
,onald46,https://www.tiktok.com/@onald46,se-candu itu wangi nya Morris,Positif,Positif,24/04/2023
,deludeldelito4,https://www.tiktok.com/@deludeldelito4,"aku mau batalin karena kelamaan, tapi gak bisa",Negatif,Negatif,24/04/2023
,bonostore.com,https://www.tiktok.com/@bonostore.com,masyaAllah wangi banget parfum nya,Positif,Positif,24/04/2023
,rionoslamet,https://www.tiktok.com/@rionoslamet,"paling suka yang varian floral, aroma nya manis buah",Positif,Positif,24/04/2023
,enamg5,https://www.tiktok.com/@enamg5,"bohong, biasa aja wangi nya ga ada sensasi lebih",Negatif,Negatif,24/04/2023
,awanawai0,https://www.tiktok.com/@awanawai0,"parfum andalan dari zaman sekolah udah pakai, emang lembut banget wangi nya",Positif,Positif,23/04/2023
,rizkyyo14,https://www.tiktok.com/@rizkyyo14,iya kah? ga meyakinkan,Negatif,Negatif,23/04/2023
,rizkyyo14,https://www.tiktok.com/@rizkyyo14,wangi nya bikin pacar aku nempel terus sama aku,Positif,Positif,23/04/2023
,azzatrign,https://www.tiktok.com/@azzatrign,se-cinta itu sama parfum ini,Positif,Positif,23/04/2023
,dicki9153,https://www.tiktok.com/@dicki9153,"aku pakai parfum Morris bang, wangi nya candu, apalagi pas dipakai lebaran, gak hilang-hilang",Positif,Positif,23/04/2023
,keyzty2019,https://www.tiktok.com/@keyzty2019,"beli di alfamart ada, ngapain beli online",Negatif,Negatif,23/04/2023
,tokunime_2,https://www.tiktok.com/@tokunime_2,"energy sama ocean breeze enak banget, aku udah beli tiga kali parfum nya",Positif,Positif,23/04/2023
,user3192555552574,https://www.tiktok.com/@user3192555552574,"pakai Morris, jalanin hari tetap fresh, emang parfum terbaik ini",Positif,Positif,23/04/2023
,sunarto5947,https://www.tiktok.com/@sunarto5947,merek murahan kebanyakan alkohol nya bikin baju kuning,Negatif,Negatif,23/04/2023
,harsultra,https://www.tiktok.com/@harsultra,aku lebih suka parfum pasar malam dari pada parfum ini wangi nya cepat banget hilang wangi nya,Negatif,Negatif,23/04/2023
,dicky38581,https://www.tiktok.com/@dicky38581,lebih murah ya di banding di offline store nya,Positif,Positif,23/04/2023
,user5561409521665,https://www.tiktok.com/@user5561409521665,"mbak, kok ongkos kirim nya mahal sekali ya ke Bojonegoro, Jawa Timur",Negatif,Negatif,23/04/2023
,jayalie69,https://www.tiktok.com/@jayalie69,tolong lah benarkan itu kualitas parfum nya bikin gatel dan panas di kulit,Negatif,Negatif,23/04/2023
,shary_89,https://www.tiktok.com/@shary_89,anggun banget wangi nya,Positif,Positif,23/04/2023
,johanisppatty,https://www.tiktok.com/@johanisppatty,pesanan aku gak sampai-sampai gimana ini,Negatif,Negatif,22/04/2023
,nandesphnnandes6,https://www.tiktok.com/@nandesphnnandes6,"Aamiin, sukses selalu parfum Morris",Positif,Positif,22/04/2023
,samsulbae612s,https://www.tiktok.com/@samsulbae612s,bisa ga sih ongkos kirim nya di kurangin yang sekarang mahal banget massa lebih mahl dari parfum nya,Negatif,Negatif,22/04/2023
,kastimm,https://www.tiktok.com/@kastimm,"cowok aku pakai yang black edition, gentleman banget aroma nya enak dan buat nyaman",Positif,Positif,22/04/2023
,hasanpencor5,https://www.tiktok.com/@hasanpencor5,wangi nya tahan seharian di pakai naik motor emang mantap nih parfum,Positif,Positif,22/04/2023
,rohmatsejati,https://www.tiktok.com/@rohmatsejati,"isian nya ga penuh, padahal baru sampai",Negatif,Negatif,22/04/2023
,edopmu,https://www.tiktok.com/@edopmu,lama banget asli datang nya,Negatif,Negatif,22/04/2023
,herian65,https://www.tiktok.com/@herian65,pengemasan nya buruk banget ga ada pengaman botol nya sama sekali,Negatif,Negatif,22/04/2023
,difafafa,https://www.tiktok.com/@difafafa,"aku pakai olahraga, masih kecium wangi nya",Positif,Positif,21/04/2023
,putramasamajaya,https://www.tiktok.com/@putramasamajaya,saking enak dan bikin nyaman teman-teman sekolah aku sampai pada nanya parfum yang aku pakai,Positif,Positif,21/04/2023
,user3762702161024,https://www.tiktok.com/@user3762702161024,wangi nya sama persis kayak yang dipakai aku emang iklan nya ga pernah bohong keren deh morris,Positif,Positif,21/04/2023
,artiswedding,https://www.tiktok.com/@artiswedding,bahan botol nya buruk banget pas sampai langsung pecah,Negatif,Negatif,21/04/2023
,jerryjuan4,https://www.tiktok.com/@jerryjuan4,"harum wangi nya, botol parfum nya juga cantik-cantik",Positif,Positif,21/04/2023
,munadzirah_170514,https://www.tiktok.com/@munadzirah_170514,"udah ada banyak botol parfum Morris di meja kamar aku, karena memang se-suka itu",Positif,Positif,21/04/2023
,alifaalifa379,https://www.tiktok.com/@alifaalifa379,"kemarin aku beli satu, mama aku juga suka, jadi beli lagi deh",Positif,Positif,21/04/2023
,rahmanradiansiah,https://www.tiktok.com/@rahmanradiansiah,mudah hilang ah wangi nya,Negatif,Negatif,21/04/2023
,poncollili607,https://www.tiktok.com/@poncollili607,ongkos kirim ke bali berapa ka,Netral,Netral,21/04/2023
,edoy_pengky,https://www.tiktok.com/@edoy_pengky,mahal di ongkos kirim nya,Negatif,Negatif,21/04/2023
,danisidsenja,https://www.tiktok.com/@danisidsenja,mantap betul wangi nya aku suka sama yang metropolis,Positif,Positif,20/04/2023
,makan_yukges,https://www.tiktok.com/@makan_yukges,"mantap, ini yang gold enak banget",Positif,Positif,20/04/2023
,amatamat7995,https://www.tiktok.com/@amatamat7995,"kak, aku sudah order 6 hari yang lalu, kok tulisan nya masih menunggu kurir? Kata nya bakal dibatalin",Negatif,Negatif,20/04/2023
,erwin_dharmawan,https://www.tiktok.com/@erwin_dharmawan,"kemarin beli Morris tiga puluh tiga ribu, kak, sekarang naik jadi empat puluh tujuh ribu",Negatif,Negatif,20/04/2023
,pida006,https://www.tiktok.com/@pida006,"aku kemarin sempat beli, kak, tapi paket hilang pas pengiriman",Negatif,Negatif,20/04/2023
,vagetos8930911361128,https://www.tiktok.com/@vagetos8930911361128,sekelas Morris cuma mikirin untung tanpa mikirin kepuasan pelanggan nya,Negatif,Negatif,20/04/2023
,maxximin72,https://www.tiktok.com/@maxximin72,"aku udah borong, kak, keluarga aku semua nya suka varian morris",Positif,Positif,20/04/2023
,abdul_mutolib09,https://www.tiktok.com/@abdul_mutolib09,"promo di online shop lebih murah, kayak di Indomaret empat puluh lima ribu, di online shop dua puluh delapan ribu",Positif,Positif,20/04/2023
,sitisaira187,https://www.tiktok.com/@sitisaira187,"aku di Malaysia, beli metropolis wangi sangat",Positif,Positif,19/04/2023
,mulyaniraydixit,https://www.tiktok.com/@mulyaniraydixit,Kok isi nya gak penuh,Negatif,Negatif,19/04/2023
,guru_3t,https://www.tiktok.com/@guru_3t,gila sih ini wangi nya enak banget,Positif,Positif,19/04/2023
,pramana_reza_,https://www.tiktok.com/@pramana_reza_,langganan Morris karena wangi nya segar-segar,Positif,Positif,19/04/2023
,adenurjanah11,https://www.tiktok.com/@adenurjanah11,saya mau dong kakak cantik parfum nya,Positif,Positif,19/04/2023
,siharyati411,https://www.tiktok.com/@siharyati411,pengiriman lama,Negatif,Negatif,19/04/2023
,aradik123,https://www.tiktok.com/@aradik123,"aku Jakarta Barat juga, tapi kok ga dikirim-kirim juga ya, kak",Negatif,Negatif,19/04/2023
,nurulnisa2406,https://www.tiktok.com/@nurulnisa2406,ongkos kirim nya mahal banget,Negatif,Negatif,19/04/2023
,tobu123456,https://www.tiktok.com/@tobu123456,emang wangi banget parfum ini,Positif,Positif,19/04/2023
,irsanleosaputra,https://www.tiktok.com/@irsanleosaputra,"masa? aku pakai, tapi wangi nya cepat hilang",Negatif,Negatif,19/04/2023
,www.tiktok.comramlah87,https://www.tiktok.com/@www.tiktok.comramlah87,Morris Indonesia emang terbaik,Positif,Positif,18/04/2023
,kingiclik_77,https://www.tiktok.com/@kingiclik_77,Tetap Morris di era gempuran grey dan hrny,Positif,Positif,18/04/2023
,purkonsehat,https://www.tiktok.com/@purkonsehat,"lumayan lah aroma nya, tapi cepat bosan",Negatif,Negatif,18/04/2023
,jaenudin661,https://www.tiktok.com/@gonderong45,nunggu kurir lima hari,Negatif,Negatif,18/04/2023
,ranti1550,https://www.tiktok.com/@ranti1550,"suka yang aquatic, wangi nya manly banget",Positif,Positif,18/04/2023
,alvin.al.buchori,https://www.tiktok.com/@alvin.al.buchori,wangi nya asik banget buat maen sama teman,Positif,Positif,18/04/2023
,hadibambu_jaya0,https://www.tiktok.com/@hadibambu_jaya0,"baru sampai, tapi tutup nya pecah",Negatif,Negatif,18/04/2023
,zivankzo,https://www.tiktok.com/@zivankzo,baru kali ini beli parfum ga dapat box dan pengemasan nya jelek asli,Negatif,Negatif,18/04/2023
,sartiansaleppang,https://www.tiktok.com/@sartiansaleppang,"baru kali ini pesan barang kurang satu, biasa nya ngga",Negatif,Negatif,18/04/2023
,haiardi13,https://www.tiktok.com/@haiardi13,"kak, yang wangi nya kalem, bad boy, buat cowok yang mana ya?",Netral,Netral,17/04/2023
,user6608133112231,https://www.tiktok.com/@user6608133112231,"botol retak, padahal di bubble wrap satu per satu",Negatif,Negatif,17/04/2023
,sarimiisidoa,https://www.tiktok.com/@sarimiisidoa,ada alkohol nya kak?,Netral,Netral,17/04/2023
,edelweiss__11,https://www.tiktok.com/@edelweiss__11,wangi nya mirip minyak wangi yang di Alfamart,Netral,Netral,17/04/2023
,bliketutagus88,https://www.tiktok.com/@bliketutagus88,pakai parfum ini biar gampang dapat jodoh,Positif,Positif,17/04/2023
,adzrin57,https://www.tiktok.com/@adzrin57,"ongkos kirim nya kemahalan, kak",Negatif,Negatif,16/04/2023
,zaqistory23,https://www.tiktok.com/@zaqistory23,"daerah mana, harga nya berapa? ",Netral,Netral,16/04/2023
,jagoanbabehh_,https://www.tiktok.com/@jagoanbabehh_,"Ini buat dalem ruangan, kalau banyak kegiatan di luar gak disarankan karena ini parfum lembut gitu, kalau di luar butuh yang agak kuat wangi nya",Netral,Netral,16/04/2023
,user6143130856521,https://www.tiktok.com/@user6143130856521,"bismillah semoga aku dapat, aamiin",Positif,Positif,16/04/2023
,adunanwar,https://www.tiktok.com/@adunanwar,"Assalamualaikum, aku udah beli nih kak wangi nya enak banget aku suka sama yang aquatic",Positif,Positif,16/04/2023
,sarapudinudin1,https://www.tiktok.com/@sarapudinudin1,"isi nya kok ga full ya, seperti sudah dipakai",Negatif,Negatif,16/04/2023
,dwiwahyuni5528,https://www.tiktok.com/@dwiwahyuni5528,"biasa aja wangi nya, gak yang enak banget",Negatif,Negatif,16/04/2023
,analanang419,https://www.tiktok.com/@analanang419,Saya sangat kecewa dengan pelayanan pelanggan yang buruk,Negatif,Negatif,15/04/2023
,wannn.16,https://www.tiktok.com/@wannn.16,"yang biru wangi nya enak banget,kak , saya suka, bismillah dapat morris gratis",Positif,Positif,15/04/2023
,irwan_135790,https://www.tiktok.com/@irwan_135790,"saya pesan nya pure romantic, yang datang nya midnight love",Negatif,Negatif,15/04/2023
,msglowkalimantan,https://www.tiktok.com/@msglowkalimantan,"wangi nya enak, lembut, segar, seperti parfum berkelas",Positif,Positif,15/04/2023
,afdalfiransyah6,,"wangi nya belum juga satu jam, sudah hilang",Negatif,Negatif,15/04/2023
,afdalfiransyah6,https://www.tiktok.com/@afdalfiransyah6,aroma nya tajam banget bikin pusing kepala,Negatif,Negatif,15/04/2023
,risamia56,https://www.tiktok.com/@afdalfiransyah6,"botol nya elegan, seperti botol parfum mahal",Positif,Positif,15/04/2023
,rifqohsufi,https://www.tiktok.com/@rifqohsufi,estimasi pengiriman nya lama banget,Negatif,Negatif,15/04/2023
,cucum1217,https://www.tiktok.com/@cucum1217,"wangi nya kalem, dengan harga segitu mantap",Positif,Positif,14/04/2023
,wanpiro9,https://www.tiktok.com/@wanpiro9,suka banget sama wangi nya,Positif,Positif,14/04/2023
,selfi_76c,https://www.tiktok.com/@selfi_76c,lima sampai sepuluh menit sudah gak ada bau nya,Negatif,Negatif,14/04/2023
,fsjabw,https://www.tiktok.com/@fsjabw,"gak enak, cepat hilang juga aroma nya",Negatif,Negatif,14/04/2023
,mfazilah304,https://www.tiktok.com/@mfazilah304,kurang puas,Negatif,Negatif,14/04/2023
,jamalabnas,https://www.tiktok.com/@jamalabnas,wow emang se-harum itu Morris,Positif,Positif,14/04/2023
,liyasusanty02,https://www.tiktok.com/@liyasusanty02,"aku pakai kak, wangi banget",Positif,Positif,14/04/2023
,egi_mabu,https://www.tiktok.com/@egi_mabu,barang tidak sesuai dengan keinginan aku,Negatif,Negatif,13/04/2023
,alfianfian1811,https://www.tiktok.com/@alfianfian1811,"kelamaan di toko nya, gak dikirim-kirim",Negatif,Negatif,13/04/2023
,user363293705130,https://www.tiktok.com/@user363293705130,Layanan pelanggan nya lambat dalam menanggapi masalah pelanggan,Negatif,Negatif,13/04/2023
,sawitrirahmadani3,https://www.tiktok.com/@sawitrirahmadani3,wangi-wangi semua parfum nya,Positif,Positif,13/04/2023
,wiwinwinda280,https://www.tiktok.com/@wiwinwinda280,Sistem pembayaran nya sering kali bermasalah,Negatif,Negatif,13/04/2023
,yeahmntp,https://www.tiktok.com/@yeahmntp,wow aku dapat di harga delapan belas ribu murah banget,Positif,Positif,13/04/2023
,afiqabiancaa,https://www.tiktok.com/@afiqabiancaa,bau tidak sesuai ekspektasi,Negatif,Negatif,13/04/2023
,user8440358149637,https://www.tiktok.com/@user8440358149637,masya Allah harum sekali wangi nya,Positif,Positif,13/04/2023
,user8873158781961,https://www.tiktok.com/@user8873158781961,harum nya gak seperti yang aku beli di Alfamart,Negatif,Negatif,13/04/2023
,sriwarnidawati3,https://www.tiktok.com/@sriwarnidawati3,"cantik banget botol nya, wangi nya juga harum",Positif,Positif,13/04/2023
,yusupjaelani78,https://www.tiktok.com/@yusupjaelani78,wangi nya asik banget buat jalan jalan sama keluarga,Positif,Positif,13/04/2023
,alfianfian1811,https://www.tiktok.com/@alfianfian1811,"parah banget, aku malah dikirim woody dua-dua nya",Negatif,Negatif,13/04/2023
,akashalwinism,https://www.tiktok.com/@moritzhau779,"mantap banget sih ini, emang wangi banget varian metropolis nya",Positif,Positif,12/04/2023
,rendiafriansah885,https://www.tiktok.com/@rendiafriansah885,produk memuaskan,Positif,Positif,12/04/2023
,muliyadi994,https://www.tiktok.com/@muliyadi994,"bau nya gak enak banget, terus gak tahan lama lagi",Negatif,Negatif,12/04/2023
,trimo5008,https://www.tiktok.com/@trimo5008,jangan percaya iklan nya bohong,Negatif,Negatif,12/04/2023
,user8766958022907,https://www.tiktok.com/@user8766958022907,"mantap, elegan dan lembut banget wangi nya",Positif,Positif,12/04/2023
,lennysikumbang221185,https://www.tiktok.com/@lennysikumbang221185,"pengiriman lama, padahal jasa pengiriman express",Negatif,Negatif,12/04/2023
,kulokokos,https://www.tiktok.com/@kulokokos,aku bayar make gopay lebih mahal,Negatif,Negatif,12/04/2023
,user9113490876802,https://www.tiktok.com/@user9113490876802,masyaAllah toko nya juga amanah,Positif,Positif,12/04/2023
,adekamaludinkamal,https://www.tiktok.com/@adekamaludinkamal,"yang bener? aku udah beli, gak tahan lama tapi tuh wangi nya",Negatif,Negatif,12/04/2023
,dwialifapriliano,https://www.tiktok.com/@dwialifapriliano,sweet banget aroma nya aku suka emang mantap,Positif,Positif,12/04/2023
,penjahitprima1,https://www.tiktok.com/@penjahitprima1,"toko gak amanah, karyawan nya kerja nya lama",Negatif,Negatif,12/04/2023
,agilnihkidsaenggoldong,https://www.tiktok.com/@agilnihkidsaenggoldong,"aroma nya enak-enak, dari dulu suka sama parfum Morris",Positif,Positif,12/04/2023
,cangrahman71,https://www.tiktok.com/@cangrahman71,"sangat kecewa, aku beli nya 3, tapi yang dikirim cuma 1",Negatif,Negatif,12/04/2023
,user461239977998,https://www.tiktok.com/@user461239977998,sudah berapa hari gak dikirim-kirim,Negatif,Negatif,12/04/2023
,triztanrize,https://www.tiktok.com/@triztanrize,"sudah beli, enak banget wangi nya, tahan lama pula",Positif,Positif,11/04/2023
,kamal_acehselatan1,https://www.tiktok.com/@kamal_acehselatan1,"barang aku kapan dikirim, lama banget",Negatif,Negatif,11/04/2023
,farhaanwar19,https://www.tiktok.com/@farhaanwar19,"mantap, bikin kecanduan wangi nya",Positif,Positif,11/04/2023
,robertmorisonhtgalung,https://www.tiktok.com/@robertmorisonhtgalung,"sekali semprot, tiga detik wangi nya hilang",Negatif,Negatif,11/04/2023
,vanialaiaaurora,https://www.tiktok.com/@vanialaiaaurora,aku suka Morris,Positif,Positif,11/04/2023
,koreanbagstore,https://www.tiktok.com/@koreanbagstore,sudah pakai dari dulu ga mau perpindah ke parfum lain,Positif,Positif,11/04/2023
,itasitra,https://www.tiktok.com/@itasitra,paket aku sudah 7 hari belum dikirim juga,Negatif,Negatif,11/04/2023
,srisudarsih53,https://www.tiktok.com/@srisudarsih53,"wangi kue, bikin pusing",Negatif,Negatif,11/04/2023
,user3661695792353,https://www.tiktok.com/@user3661695792353,"wangi nya enak banget, terbaik",Positif,Positif,11/04/2023
,ardhany.nd,https://www.tiktok.com/@ardhany.nd,Mantap lah morris dari dulu semua varian nya aku suka,Positif,Positif,11/04/2023
,yanipurbalingga2,https://www.tiktok.com/@yanipurbalingga2,"wangi nya aneh, ga seperti biasa nya, jadi takut beli lagi",Negatif,Negatif,11/04/2023
,aliuslius295,https://www.tiktok.com/@aliuslius295,sangat disarankan untuk beli harga nya murah tapi kualitas mahal,Positif,Positif,11/04/2023
,mmhndha182,https://www.tiktok.com/@mmhndha182,"wangi nya kurang, kebanyakan alkohol nya",Negatif,Negatif,11/04/2023
,bosdjarot,https://www.tiktok.com/@bosdjarot,"wangi sih parfum nya, tapi sayang cepat hilang",Negatif,Negatif,11/04/2023
,marshalie777,https://www.tiktok.com/@marshalie777,agak nyengat pas awal,Negatif,Negatif,11/04/2023
,nilasari1912,https://www.tiktok.com/@nilasari1912,"wangi nya beneran bikin candu banget, aku suka banget sama varian aquatic",Positif,Positif,11/04/2023
,subarti4,https://www.tiktok.com/@subarti4,pengemasan rusak,Negatif,Negatif,11/04/2023
,putrairwan830.gmailcom,https://www.tiktok.com/@putrairwan830.gmailcom,lain waktu beli lagi udah cocok sama aroma nya nikmat dan enak banget,Positif,Positif,11/04/2023
,pattanda99,https://www.tiktok.com/@pattanda99,"suka banget, harum",Positif,Positif,11/04/2023
,raja_pangosau,https://www.tiktok.com/@raja_pangosau,"jauh dari ekspektasi, dikira wangi dan tahan lama, ternyata biasa-biasa aja",Negatif,Negatif,11/04/2023
,papiargieathar,https://www.tiktok.com/@papiargieathar,pengemasan nya sering rusak,Negatif,Negatif,11/04/2023
,pp.kamboja86,https://www.tiktok.com/@pp.kamboja86,Layanan pengiriman nya tidak profesional,Negatif,Negatif,10/04/2023
,gunawanhitanto,https://www.tiktok.com/@gunawanhitanto,Pengalaman berbelanja aku di sini buruk karena lama dalam pengiriman nya,Negatif,Negatif,10/04/2023
,nhatan067,https://www.tiktok.com/@nhatan067,toko penipu iklan nya bohong semua,Negatif,Negatif,10/04/2023
,bulik.atin,https://www.tiktok.com/@bulik.atin,di pengiriman nya jangan lama-lama dong jelek banget massa penggiriman 2 minggu,Negatif,Negatif,10/04/2023
,bogel_.5,https://www.tiktok.com/@bogel_.5,"tahan lama nih parfum, aku aja beli, murah",Positif,Positif,09/04/2023
,novalandreyansah,https://www.tiktok.com/@novalandreyansah,"memang enak sih Morris yang itu, ketiak basah jadi kering, ketagihan wangi nya cool dan segar",Positif,Positif,09/04/2023
,abellabella43,https://www.tiktok.com/@abellabella43,pengiriman ke tanggerang berapa hari? ,Netral,Netral,09/04/2023
,abellabella43,https://www.tiktok.com/@abellabella43,yang varian aquatic bau nya gimana ka?,Netral,Netral,09/04/2023
,mahligaicinta145,https://www.tiktok.com/@mahligaicinta145,mahal ongkos kirim nya sama harga parfum nya mahal,Negatif,Negatif,08/04/2023
,.capricorn003,https://www.tiktok.com/@.capricorn003,semprotan nya sulti di gunakan,Negatif,Negatif,07/04/2023
,doel9154,https://www.tiktok.com/@doel9154,Kebijakan pengembalian sangat rumit,Negatif,Negatif,06/04/2023
,sevz123,https://www.tiktok.com/@sevz123,"kak, bisa bayar di tempat dong, nanti aku borong",Netral,Netral,06/04/2023
,farizallll01,https://www.tiktok.com/@farizallll01,"kak, tutorial cara pakai parfum supaya lama nempel di sekitar tubuh kita, aku peminat Morris, kak",Netral,Netral,01/04/2023
,octav_sutansayidi,https://www.tiktok.com/@octav_sutansayidi,gak menyesal beli dua sekaligus wangi banget,Positif,Positif,01/04/2023
,calonangkatanmiliterlaut,https://www.tiktok.com/@calonangkatanmiliterlaut,jadi dua puluh tujuh ribu,Netral,Netral,31/03/2023
,nopalex13,https://www.tiktok.com/@nopalex13,Pengiriman nya lama banget,Negatif,Negatif,30/03/2023
,kuda_hitam93,https://www.tiktok.com/@kuda_hitam93,"ekslusif, mantap banget aroma nya aku suka",Positif,Positif,30/03/2023
,65t19,https://www.tiktok.com/@65t19,di Alfamart lebih murah,Negatif,Negatif,29/03/2023
,ariefin23_r,https://www.tiktok.com/@ariefin23_r,rekomendasi yang buat sekolah sama jalan-jalan apa?,Netral,Netral,28/03/2023
,lipo.58mlbb,https://www.tiktok.com/@lipo.58mlbb,"kak, kemarin sudah pesan, tapi salah kirim alamat, gimana kak cara ganti alamat nya? ",Netral,Netral,28/03/2023
,me2t_1986,https://www.tiktok.com/@me2t_1986,ya sumpah wangi banget yang ocean breeze,Positif,Positif,27/03/2023
,799above,https://www.tiktok.com/@799above,"yang metropolis enak banget, aku pakai",Positif,Positif,26/03/2023
,orangg7780,https://www.tiktok.com/@orangg7780,wangi nya enakan mana sih metropolis sama vintage?,Netral,Netral,24/03/2023
,w...y2011,https://www.tiktok.com/@w...y2011,Layanan keluhan pelanggan nya sulit dihubungi,Negatif,Negatif,23/03/2023
,marlik227,https://www.tiktok.com/@marlik227,parfum nya ga layak pake leher aku jadi panas pas make ini parfum,Negatif,Negatif,23/03/2023
,rhelyaurelia,https://www.tiktok.com/@rhelyaurelia,"wangi nya kurang kuat, mudah hilang",Negatif,Negatif,23/03/2023
,kiinasih986,https://www.tiktok.com/@kiinasih986,dipakai keluar beberapa jam sudah hilang aja wangi nya,Negatif,Negatif,23/03/2023
,fauzi_arifin79,https://www.tiktok.com/@fauzi_arifin79,toko ga modal massa beli parfum ga dapat box nya,Negatif,Negatif,23/03/2023
,jimantoto6,https://www.tiktok.com/@jimantoto6,ada parfum lain yang lebih murah dari ini dan wangi nya jauh lebih enak,Negatif,Negatif,23/03/2023
,ateirfan176,https://www.tiktok.com/@ateirfan176,iklan pembohong ga sesuai dengan kenyataan nya,Negatif,Negatif,23/03/2023
,yantoghaluh,https://www.tiktok.com/@yantoghaluh,kalau buat cowo yang bagus apa? ,Netral,Netral,22/03/2023
,arjunaireng4644,https://www.tiktok.com/@arjunaireng4644,wangi nya manis-manis gitu aku suka deh poko nya mantap,Positif,Positif,22/03/2023
,thomastzy6,https://www.tiktok.com/@thomastzy6,selera aku banget Morris ini,Positif,Positif,22/03/2023
,eghiecintexs,https://www.tiktok.com/@eghiecintexs,"kurang cocok sama wangi nya, apalagi yang vanilla",Negatif,Negatif,22/03/2023
,yanuarprihambodo,https://www.tiktok.com/@yanuarprihambodo,emang boleh se-harum ini? ,Positif,Positif,22/03/2023
,ulfatr73,https://www.tiktok.com/@ulfatr73,"pelanggan setia Morris, hadir",Positif,Positif,22/03/2023
,marwandjumaati0,https://www.tiktok.com/@marwandjumaati0,"wangi nya masih ada, walaupun sudah lewat orang nya",Positif,Positif,22/03/2023
,fatbinan55,https://www.tiktok.com/@fatbinan55,lama deh pengiriman nya,Negatif,Negatif,22/03/2023
,muharis188,https://www.tiktok.com/@muharis188,aku pernah nyoba parfum teman yang varian aquatic bau nya ga enak,Negatif,Negatif,22/03/2023
,xxhy71,https://www.tiktok.com/@xxhy71,kata mama aku alkhol nya terlalu banyak bikin pusing kepala,Negatif,Negatif,22/03/2023
,matom987,https://www.tiktok.com/@matom987,"jadi ingin coba varian lain nya,kemarin beli yang metropolis enak banget bau nya",Positif,Positif,22/03/2023
,ipunktiaman,https://www.tiktok.com/@ipunktiaman,"mau beli parfum nya, botol nya cakep banget",Positif,Positif,21/03/2023
,bustamam4321,https://www.tiktok.com/@bustamam4321,mantap Morris dari dulu aroma nya tetap di pertahankan,Positif,Positif,21/03/2023
,leosof16,https://www.tiktok.com/@leosof16,"lebih enak parfum yang sebelah, lebih murah juga",Negatif,Negatif,21/03/2023
,warunggaul749,https://www.tiktok.com/@warunggaul749,aku mau nabung agar bisa borong semua varian,Positif,Positif,21/03/2023
,gudangoufitremaja,https://www.tiktok.com/@gudangoufitremaja,"biasa saja wangi nya, seperti parfum-parfum yang lain",Negatif,Negatif,21/03/2023
